{
  "project_id": "proj_2d2440288dc4",
  "title": "Simple span — primary member (M3 trunk)",
  "description": "Single trunk branch for the simple-span steel workflow; alternatives are sibling options under the decision node.",
  "origin_decision_node_id": null,
  "origin_alternative_id": null,
  "root_node_id": "node_73b45fe6cf5e",
  "state": "explored",
  "parent_branch_id": null,
  "cloned_from_branch_id": null,
  "reactivated_from_branch_id": null,
  "comparison_tags": [
    "eligible_options:4",
    "simple_span_steel_m3",
    "span_m:10",
    "suggested_top_k:3",
    "support:simple_span"
  ],
  "id": "branch_9f6a3aecf366",
  "created_at": "2026-04-18T19:05:37.458270+00:00",
  "updated_at": "2026-04-18T19:05:37.808708+00:00"
}